{
  "build_revision": "8b033ba65a65a3130c39e2adedcbd85906d768b3",
  "cgroup_available": true,
  "cohorts": [
    {
      "attempted_samples": 20,
      "cache_cohort": "cold",
      "command_class": "noop",
      "invalid_reason": null,
      "successful_samples": 20,
      "valid": true
    },
    {
      "attempted_samples": 20,
      "cache_cohort": "warm",
      "command_class": "noop",
      "invalid_reason": null,
      "successful_samples": 20,
      "valid": true
    },
    {
      "attempted_samples": 20,
      "cache_cohort": "cold",
      "command_class": "read-validate",
      "invalid_reason": null,
      "successful_samples": 20,
      "valid": true
    },
    {
      "attempted_samples": 20,
      "cache_cohort": "warm",
      "command_class": "read-validate",
      "invalid_reason": null,
      "successful_samples": 20,
      "valid": true
    },
    {
      "attempted_samples": 20,
      "cache_cohort": "cold",
      "command_class": "single-file-write",
      "invalid_reason": null,
      "successful_samples": 20,
      "valid": true
    },
    {
      "attempted_samples": 20,
      "cache_cohort": "warm",
      "command_class": "single-file-write",
      "invalid_reason": null,
      "successful_samples": 20,
      "valid": true
    }
  ],
  "evidence": {
    "jsonl_path": ".agents/plans/aqos-foundation-c/r4-acceptance-revocation-20260730-cap2.jsonl",
    "jsonl_sha256": "06f74deb1d316d3944b62c548cf58009311d32eb3dd7c7943f6f36382219f0a2",
    "row_count": 120
  },
  "generated_at": "2026-07-30T15:53:26.754012+00:00",
  "host_fingerprint": {
    "cpu_governor": "schedutil",
    "hostname": "hyperd",
    "kernel": "7.1.3",
    "machine": "x86_64",
    "mem_total_bytes": 29237157888
  },
  "idle_baseline_bytes": 0,
  "revocation_under_load": {
    "all_assertions_passed": true,
    "concurrency_cap": 2,
    "failures": [],
    "skipped": [],
    "teardown_latency_p95_s": 0.002418394
  },
  "run_id": "676848c1c458434baff0007adb5374e8",
  "schema_version": 1,
  "verdict": {
    "failures": [],
    "invalid_cohorts": [],
    "metrics_unavailable": [],
    "status": "PASS"
  }
}
